{
  "name": "gmail.draft",
  "version": "0.0.1",
  "risk": "medium",
  "capabilities": ["gmail.send"],
  "inputs": {
    "type": "object",
    "properties": {
      "to": { "type": "string" },
      "subject": { "type": "string" },
      "body": { "type": "string" }
    }
  },
  "outputs": {
    "type": "object",
    "properties": { "draftId": { "type": "string" } }
  }
}
